{
  "schema_version": "v1",
  "evidence_id": "0190f5c2-7c1e-7ad3-8def-1234567890ab",
  "space_id": "0190f5c2-7c1e-7ac0-8def-1234567890ab",
  "correlation_id": "0190f5c2-7c1e-7abe-8def-1234567890ab",
  "run_id": "0190f5c2-7c1e-7ac1-8def-1234567890ab",
  "evidence_bundle_id": "0190f5c2-7c1e-7ad5-8def-1234567890ab",
  "index_version_id": "0190f5c2-7c1e-7ad6-8def-1234567890ab",
  "document_revision_id": "0190f5c2-7c1e-7ad8-8def-1234567890ab",
  "parent_chunk_id": "0190f5c2-7c1e-7ad9-8def-1234567890ab",
  "child_chunk_id": "0190f5c2-7c1e-7ada-8def-1234567890ab",
  "content_ref": "artifact:doc-001/chunk-001",
  "text_hash": "aaaaaaaaaaaaaaaaaaaaaaaaaaaaaaaaaaaaaaaaaaaaaaaaaaaaaaaaaaaaaaaa",
  "anchor": {"heading_path": ["契约", "引用"], "token_start": 0, "token_end": 18, "char_start": 0, "char_end": 72, "page_number": 1, "sheet": null, "slide_number": null, "line_start": 1, "line_end": 4, "table_cell": null},
  "citation_allowed": true
}
